{
  "schemaVersion": 1,
  "id": "783cbbe6-1f1b-4727-aadc-dfc04e3c5eca",
  "turnId": "f649c404-7ab0-436a-8691-8662cd4a139d",
  "kind": "image",
  "title": "Overall progress with unfinished work — mobile",
  "path": ".spec-ledger/evidence/screenshots/discovery-fix/progress-mobile.png",
  "mediaType": "image/png",
  "byteLength": 71022,
  "contentDigest": "25a97ba3ce41b52ba11a1e4f5318f1a5aaa9f6d3c17ef552fa4d8c564ba7d5d6",
  "visualEvidence": {
    "sliceId": "25eac677-2871-816d-956d-770bdcb61798",
    "surface": "Overall progress with unfinished work — mobile",
    "sourceDigest": "7bd5f5b2dd8a1b5c3e7f20a70632596b99441887b4892e8617c871fbfa8cea98",
    "revisionDigest": "a584acc3319d6700424703bddc1a76f38453c55b9f38d5926321a48842b476c1",
    "recordedAt": "2026-09-06T21:58:03.707Z"
  },
  "note": "Recorded visual coverage; image adequacy is assessed in review."
}
